id,title,genres,release_year,popularity,poster_url,combined_features
155,The Dark Knight,Drama Action Crime Thriller,2008,187.322927,,"Batman raises the stakes in his war on crime. With the help of Lt. Jim Gordon and District Attorney Harvey Dent, Batman sets out to dismantle the remaining criminal organizations that plague the streets. The partnership proves to be effective, but they soon find themselves prey to a reign of chaos unleashed by a rising criminal mastermind known to the terrified citizens of Gotham as the Joker. Drama Action Crime Thriller dc comics crime fighter secret identity scarecrow sadism chaos gotham city vigilante joker superhero based on comic book tragic hero organized crime criminal mastermind district attorney imax super villain super powers batman Christian Bale Heath Ledger Aaron Eckhart Michael Caine Maggie Gyllenhaal Christopher Nolan"
11004,Wonder Boys,Comedy Drama,2000,9.011729,,"Grady (Michael Douglas) is a 50-ish English professor who hasn't had a thing published in years -- not since he wrote his award winning ""Great American Novel"" 7 years ago. This weekend proves even worse than he could imagine as he finds himself reeling from one misadventure to another in the company of a new wonder boy author. Comedy Drama adultery robbery based on novel professor college police party liar marijuana writer university drug dog Michael Douglas Tobey Maguire Frances McDormand Katie Holmes Rip Torn Curtis Hanson"
22,Pirates of the Caribbean: The Curse of the Black Pearl,Adventure Fantasy Action,2003,271.972889,,"Jack Sparrow, a freewheeling 17th-century pirate who roams the Caribbean Sea, butts heads with a rival pirate bent on pillaging the village of Port Royal. When the governor's daughter is kidnapped, Sparrow decides to help the girl's love save her. But their seafaring mission is hardly simple. Adventure Fantasy Action exotic island blacksmith east india trading company gold marriage proposal mutiny jamaica skeleton daughter governor wooden eye gold coin pirate alcoholic swashbuckler caribbean aftercreditsstinger pirate ship capuchin monkey tortuga Johnny Depp Geoffrey Rush Orlando Bloom Keira Knightley Jack Davenport Gore Verbinski"
1997,Deux frères,Adventure Drama Family,2004,8.884318,,"Two tigers are separated as cubs and taken into captivity, only to be reunited years later as enemies by an explorer (Pearce) who inadvertently forces them to fight each other. Adventure Drama Family brother brother relationship loss of brother cambodia chase tiger governor royalty travelling circus archaeologist Maï Anh Le Guy Pearce Oanh Nguyen Jaran 'See Tao' Petcharoen Stéphanie Lagarde Jean-Jacques Annaud"
1429,25th Hour,Crime Drama,2002,30.196039,,"The filmed adaptation from David Benioff's novel of the same name. Set in New York, a convicted drug dealer named Monty has one day left of freedom before he is sent to prison. Anger, blame, frustration, betrayal, guilt and loneliness are themes on this last day of friends, family, parties, saying goodbye, and setting things straight. A Spike Lee joint. Crime Drama prison prisoner dream drug dealer nightclub american dream male friendship melancholy girlfriend friendship aftercreditsstinger Edward Norton Philip Seymour Hoffman Barry Pepper Rosario Dawson Anna Paquin Spike Lee"
17287,Poultrygeist: Night of the Chicken Dead,Horror Comedy,2006,3.905877,,"Humans... the other white meat... Unless you're black, then it's dark meat... Or if you are Asian, then it's yellow meat... Or if you are Native American, it's red meat... Horror Comedy musical zombie Jason Yachanin Kate Graham Allyson Sereboff Robin L. Watkins Joshua Olatunde Lloyd Kaufman"
1880,Red Dawn,Action Thriller,1984,11.743085,,"It is the mid-1980s. From out of the sky, Soviet and Cuban troops begin landing on the football field of a Colorado high school. In seconds, the paratroops have attacked the school and sent a group of teenagers fleeing into the mountains. Armed only with hunting rifles, pistols and bows and arrows, the teens struggles to survive the bitter winter and Soviet KGB patrols hunting for them. Action Thriller guerrilla colorado invasion anti-communism near future red army Patrick Swayze C. Thomas Howell Lea Thompson Darren Dalton Charlie Sheen John Milius"
32740,कृष,Action Science Fiction,2006,3.759988,,"Krishna (Roshan) is born with magical powers - a legacy from his father. Priya (Chopra) comes into his life and becomes his world. When she beckons him to Singapore, he follows. In Singapore, Dr. Siddhant Arya (Shah), the megalomaniac scientist is on the verge of changing the future forever. Only one man stands between Dr. Siddharth Arya and his destructive dreams. To block his ruthless ambitions -- Krishna must become Krrish. Action Science Fiction  Hrithik Roshan Naseeruddin Shah Priyanka Chopra Rekha Sharat Saxena Rakesh Roshan"
2959,License to Wed,Comedy,2007,14.503568,,"Newly engaged, Ben and Sadie can't wait to start their life together and live happily ever after. However Sadie's family church's Reverend Frank won't bless their union until they pass his patented, ""foolproof"" marriage prep course consisting of outrageous classes, outlandish homework assignments and some outright invasion of privacy. Comedy new love ten commandments bride bridegroom marriage relation partnership civil registry office priest wedding church Robin Williams Mandy Moore John Krasinski Eric Christian Olsen Christine Taylor Ken Kwapis"
266102,Desert Dancer,Drama,2014,1.972668,,"Inspirational true story of Iranian dancer Afshin Ghaffarian, who risked his life for his dream to become a dancer despite a nationwide dancing ban. Drama dance ban from profession biography iran oppression tehran iran Freida Pinto Reece Ritchie Tom Cullen Nazanin Boniadi Marama Corlett Richard Raymond"
141,Donnie Darko,Fantasy Drama Mystery,2001,61.210016,,"After narrowly escaping a bizarre accident, a troubled teenager is plagued by visions of a large bunny rabbit that manipulates him to commit a series of crimes. Fantasy Drama Mystery parents kids relationship airplane time travel school presentation school performance suburbia vision morality teenager Jake Gyllenhaal Jena Malone Patrick Swayze Maggie Gyllenhaal Drew Barrymore Richard Kelly"
57022,Sunshine State,Drama,2002,4.245123,,"A woman and her new husband returns to her hometown roots in coastal northern Florida, and must deal with family, business, and encroaching real estate development. Drama independent film Alan King Angela Bassett Timothy Hutton Mary Steenburgen Clifton James John Sayles"
13922,The Great Raid,Action History War,2005,8.923215,,"As World War II rages, the elite Sixth Ranger Battalion is given a mission of heroic proportions: push 30 miles behind enemy lines and liberate over 500 American prisoners of war. Action History War based on novel world war ii prisoners of war narration archive footage rescue mission soldier 1940s inspired by true events fictionalized history Benjamin Bratt James Franco Connie Nielsen Marton Csokas Joseph Fiennes John Dahl"
258755,A escondidas,Romance Drama,2014,1.233688,,"At the age of 14 the world around you changes at a dizzying speed. But what if actually it's you that changing? What if these changes take you away from what up until now, has been your world? Ibrahim and Rafa are going to suffer these changes for themselves, experiencing first love in a way they never could have imagined. And having to keep it Hidden away. Romance Drama  Germán Alcarazu Adil Koukouh Ana Wagener Alex Angulo Mikel Rueda"
266857,The Work and The Story,Comedy,2003,0.002388,,"It is July, 2000 Richard Dutcher, the man who pioneered ""Mormon Cinema"" with his film ""God's Army"" is missing and presumed dead. Three amateur Mormon Filmmakers: Judy Shumway, Peter Beuhmann and Kevin Evans individually set out to make their first feature-length films to take Dutcher's place as the next ""Mormon Spielberg"". Who will win? Who will lose? Who will find Richard? And does everyone want Richard found? Comedy  Kirby Heyborne Christopher Robin Miller Eric Artell Nathan Smith Jones"
562,Die Hard,Action Thriller,1988,66.169628,,"NYPD cop, John McClane's plan to reconcile with his estranged wife is thrown for a serious loop when minutes after he arrives at her office, the entire building is overtaken by a group of terrorists. With little help from the LAPD, wisecracking McClane sets out to single-handedly rescue the hostages and bring the bad guys down. Action Thriller helicopter journalist based on novel terrorist skyscraper christmas party s.w.a.t. hostage kidnapping vault fistfight murder heist shootout los angeles one man army explosion violence fbi agent walkie talkie christmas eve elevator shaft one night action hero Bruce Willis Alan Rickman Alexander Godunov Bonnie Bedelia Reginald VelJohnson John McTiernan"
36047,The In Crowd,Thriller,2000,0.249245,,"A mentally disturbed young woman takes a job at a posh country club and falls in with a clique of wealthy college kids where she's taken under the wing of the clique's twisted leader, who harbors some dark secrets too terrifying to tell. Thriller woman director Susan Ward Lori Heuring Matthew Settle Nathan Bexton Tess Harper Mary Lambert"
82507,Sinister,Horror Thriller Mystery,2012,41.045084,,"Found footage helps a true-crime novelist realize how and why a family was murdered in his new home, though his discoveries put his entire family in the path of a supernatural entity. Horror Thriller Mystery drowning pennsylvania child murderer car set on fire murder bag over head massacre power outage hanged man held captive hanging death attic no opening credits super-8 ghost child filmed killing crime novelist Ethan Hawke Juliet Rylance Vincent D'Onofrio James Ransone Fred Dalton Thompson Scott Derrickson"
37206,A Shine of Rainbows,Drama Family,2009,12.099486,,"An orphaned boy named Tomás is adopted by Maire O’Donnell to live on a whimsical Irish isle filled with new friends, secret caves and a lost baby pup seal stranded on the coast. But when Maire's reluctant husband Alec refuses to accept Tomás as his own son, the boy drifts down a fateful path of adventure and self-discovery, illuminating how rainbows can shine around - and within - us all. Drama Family orphan rainbow Connie Nielsen Aidan Quinn John Bell Tara Alice Scully Niamh Shaw Vic Sarin"
7913,Rang De Basanti,Drama,2006,5.206967,,"A young idealistic English filmmaker, Sue, arrives in India to make a film on Indian revolutionaries Bhagat Singh, Chandrashekhar Azad and their contemporaries and their fight for freedom from the British Raj. Owing to a lack of funds, she recruits students from Delhi University to act in her docu-drama. She finds DJ, who passed out five years back but still wants to be a part of the University because he doesn't think there's too much out there in the real world to look forward to. Karan, the son of Industrialist Rajnath Singhania, who shares an uncomfortable relationship with his father, but continues to live off him, albeit very grudgingly. Aslam, is a middle class Muslim boy, who lives in the by-lanes near Jama Masjid, poet, philosopher and guide to his friends. Sukhi, the group's baby, innocent, vulnerable and with a weakness for only one thing - girls. Laxman Pandey... Drama new delhi india students' movement war of independence student celebration Aamir Khan Soha Ali Khan Alice Patten Sharman Joshi Kunal Kapoor Rakeysh Omprakash Mehra"
2085,Romeo Must Die,Action Crime Thriller,2000,19.750059,,"Two warring gang families (one African-American, the other Chinese) maneuver for bragging rights to the Oakland, California, docks. Hang SIng and Trish O'Day uncover a trail of deceit that leaves most of the warring factions dead … or worse! Action Crime Thriller martial arts hip-hop oakland asian asian man asian lead Jet Li Aaliyah Isaiah Washington Russell Wong DMX Andrzej Bartkowiak"
380097,America Is Still the Place,,0,0.0,,"1971 post civil rights San Francisco seemed like the perfect place for a black Korean War veteran and his family to realize their dream of economic independence and his own chance to be his a ""boss"". Charlie Walker would soon find out how naive he was. In a city full of impostors and naysayers, he refused to take ""No"" for an answer. Until a catastrophic disaster opened a door that had never been open to a black man before. This is a story about what happened when he stepped through that door, with both feet!.    "
11162,The Merchant of Venice,Drama Romance,2004,12.467267,,"In 16th century Venice, when a merchant must default on a large loan from an abused Jewish moneylender for a friend with romantic ambitions, the bitterly vengeful creditor demands a gruesome payment instead. Drama Romance venice shakespeare jew ship salesperson meat money suitor falling in love credit 16th century Al Pacino Jeremy Irons Joseph Fiennes Lynn Collins Zuleikha Robinson Michael Radford"
21494,Molière,Romance Drama Comedy,2007,4.61335,,"Molière, a down-and-out actor-cum-playwright up to his ears in debt. When the wealthy Jourdain offers to cover that debt (so that Molière's theatrical talents might help Jourdain win the heart of a certain widowed marquise), hilarity ensues. Romance Drama Comedy playwright Romain Duris Fabrice Luchini Edouard Baer Ludivine Sagnier Laura Morante Laurent Tirard"
225235,Географ глобус пропил,Drama,2013,1.876621,,"Victor Sluzhkin signs on as a teacher of geography in a secondary school in his native Perm (in the Urals) and gets lost in a haze of hard vodka, desperate love for a nymphet-like student and the stress of educating teenagers. Geographer, as the students immediately dub Sluzhkin, attempts to escape from the grueling, dull, stultifying reality of Russia's provincial life in a rafting tour to the Urals. Accompanied by wild, adventure-seeking adolescents, faced with the numerous grim surprises of the nature, Geographer is poised to find himself and his own truth. Drama alcohol adultery river camping province russia wife canoe daughter friendship alcoholism school teaching schoolboy geography kama perm Konstantin Khabenskiy Elena Lyadova Aleksandr Robak Evgeniya Khirivskaya Agrippina Steklova Aleksandr Veledinskiy"
13889,まあだだよ,Drama,1993,2.930853,,"This film tells the story of professor Uehida Hyakken-sama (1889-1971), in Gotemba, around the forties. He was a university professor until an air raid, when he left to become a writer and has to live in a hut. His mood has hardly changed, not by the change nor by time. Drama  Tatsuo Matsumura Kyôko Kagawa Hisashi Igawa George Tokoro Masayuki Yui Akira Kurosawa"
71469,The Darkest Hour,Horror Action Thriller Science Fiction,2011,23.328823,,"In Moscow, five young people lead the charge against an alien race which has attacked Earth via our power supply. Horror Action Thriller Science Fiction alien invasion american abroad moscow unlikely heroes failed business Emile Hirsch Rachael Taylor Olivia Thirlby Joel Kinnaman Max Minghella Chris Gorak"
119283,Parker,Action Crime,2013,28.670477,,"A thief with a unique code of professional ethics is double-crossed by his crew and left for dead. Assuming a new disguise and forming an unlikely alliance with a woman on the inside, he looks to hijack the score of the crew's latest heist. Action Crime professional thief jewel robbery Jason Statham Jennifer Lopez Nick Nolte Michael Chiklis Clifton Collins Jr Taylor Hackford"
11228,Daylight,Action Adventure Thriller,1996,16.681269,,A group of armed robbers fleeing the police head for the New Jersey Tunnel and run right into trucks transporting toxic waste. The spectacular explosion that follows results in both ends of the tunnel collapsing and the handful of people who survived the explosion are now in peril. Kit Latura is the only man with the skill and knowledge to lead the band of survivors out of the tunnel before the structure collapses. Action Adventure Thriller taxi new jersey helicopter river hero taxi driver race against time guard survival disaster new york city explosion power outage dog trapped flood tunnel christmas trapped underground action hero Sylvester Stallone Amy Brenneman Viggo Mortensen Dan Hedaya Jay O. Sanders Rob Cohen
88641,There Goes My Baby,Drama Comedy,1994,0.037073,,A group of high school seniors meets in the summer of 1965 and all struggle with the choices they have to make. Drama Comedy  Dermot Mulroney Ricky Schroder Kelli Williams Noah Wyle Lucy Deakins Floyd Mutrux
87093,Big Eyes,Drama,2014,28.570174,,"The story of the awakening of the painter, Margaret Keane, her phenomenal success in the 1950s, and the subsequent legal difficulties she had with her husband, who claimed credit for her works in the 1960s. Drama wife husband relationship artist court case Amy Adams Christoph Waltz Krysten Ritter Danny Huston Jason Schwartzman Tim Burton"
36334,Deadline - U.S.A.,Crime Drama,1952,0.225627,,"With three days before his paper folds, a crusading editor tries to expose a vicious gangster. Crime Drama  Humphrey Bogart Ethel Barrymore Kim Hunter Ed Begley Warren Stevens Richard Brooks"
9441,Stepmom,Drama Romance,1998,16.368283,,"Jackie is a divorced mother of two. Isabel is the career minded girlfriend of Jackie’s ex-husband Luke, forced into the role of unwelcome stepmother to their children. But when Jackie discovers she is ill, both women realise they must put aside their differences to find a common ground and celebrate life to the fullest, while they have the chance. Drama Romance divorce rebellious daughter freeze frame custody school play photo shoot Julia Roberts Susan Sarandon Ed Harris Jena Malone Liam Aiken Chris Columbus"
42151,Down Terrace,Drama Action Comedy,2009,1.330379,,"After serving jail time for a mysterious crime, Bill and Karl get out of jail and become preoccupied with figuring out who turned them in to the police. On top of that, the ""family business"" is on the rocks, and the motley crew of criminals who operate out of Down Terrace aren't feeling terribly trusting of one another. It might look like an ordinary house, but at Down Terrace, the walls are closing in.. Drama Action Comedy murder dark comedy crime family Robert Hill Robin Hill Julia Deakin David Schaal Tony Way Ben Wheatley"
68718,Django Unchained,Drama Western,2012,82.121691,,"With the help of a German bounty hunter, a freed slave sets out to rescue his wife from a brutal Mississippi plantation owner. Drama Western bounty hunter hero plantation society friendship friends revenge rivalry rescue shootout racism danger dentist django dual role aftercreditsstinger odd couple black slave deadly chases and races 19th century Jamie Foxx Christoph Waltz Leonardo DiCaprio Kerry Washington Samuel L. Jackson Quentin Tarantino"
72976,Lincoln,History Drama,2012,36.307296,,"A revealing drama that focuses on the 16th President's tumultuous final months in office. In a nation divided by war and the strong winds of change, Lincoln pursues a course of action designed to end the war, unite the country and abolish slavery. With the moral courage and fierce determination to succeed, his choices during this critical moment will change the fate of generations to come. History Drama usa president speech battlefield family conflict mourning american civil war cultural conflict based on true events battle of gettysburg secession presidential cabinet gettysburg address conflagration ethical dilemma emancipation abraham lincoln Daniel Day-Lewis Sally Field David Strathairn Joseph Gordon-Levitt James Spader Steven Spielberg"
250066,American Heist,Action,2014,11.431434,,"Two brothers, both with troubled paths, find themselves in the middle of one last bank job. Action brother brother relationship robbery bank Hayden Christensen Adrien Brody Jordana Brewster Akon Laura Cayouette Sarik Andreasyan"
77156,Alien Zone,Horror Action Thriller Science Fiction,1978,0.000372,,"A man who is having an affair with a married woman is dropped off on the wrong street when going back to his hotel. He takes refuge out of the rain when an old man invites him in. He turns out to be a mortician, who tells him the stories of the people who have wound up in his establishment over the course of four stories. Horror Action Thriller Science Fiction  John Ericson Ivor Francis Judith Novgrod Burr DeBenning Charles Aidman Sharron Miller"
26389,From Paris with Love,Action Crime Thriller,2010,27.916284,,"James Reese has a good job as an ambassador's aid in France, but his real passion is a side gig, working in a minor role in the CIA. He would love to be a full-fledged agent and can't believe his luck when he lands an assignment with Charlie Wax. Trigger-happy Charlie soon has James crying for his desk job, but when he learns that the same guys they're trying to catch are after him, James realizes that Charlie may be his only hope of survival. Action Crime Thriller paris cia undercover explosive pimp ambassador anti hero revelation french politician firearm deception car crash gang John Travolta Jonathan Rhys Meyers Kasia Smutniak Richard Durden Bing Yin Pierre Morel"
56930,Tycoon,Action Drama Romance,1947,0.042442,,"Engineer Johnny Munroe is enlisted to build a railroad tunnel through a mountain to reach mines. His task is complicated, and his ethics are compromised, when he falls in love with his boss's daughter Action Drama Romance mountains engineer railroad ethics John Wayne Laraine Day Cedric Hardwicke Judith Anderson Anthony Quinn Richard Wallace"
4327,Charlie's Angels,Action Adventure Comedy Crime Thriller,2000,40.20395,,"Aspects of this take on the 1970s hit TV series are similar to the original show :Angels Dylan, Natalie and Alex still work for Charlie and interface with Bosley. They still flip their hair, stop traffic with a smile and kick butt. The differences are the unsubtle humor, the martial arts training and the high-tech premise: This time, they're hot on the trail of stolen software. Action Adventure Comedy Crime Thriller martial arts female friendship millionaire agent Cameron Diaz Lucy Liu Drew Barrymore Bill Murray John Forsythe McG"
12158,Vampire in Brooklyn,Comedy Horror Romance,1995,6.772615,,"Maximillian, the lone survivor of a race of vampires, comes to Brooklyn in search of a way to live past the next full moon. His ticket to survival is Rita, a NYPD detective who doesn't know she's half vampire -- and Maximillian will do whatever's necessary to put her under his spell. Comedy Horror Romance vampire half vampire Eddie Murphy Angela Bassett Allen Payne Kadeem Hardison John Witherspoon Wes Craven"
329540,The Marine 4: Moving Target,Thriller Action,2015,3.696123,,"WWE Superstar Mike ""The Miz"" Mizanin returns as Jake Carter where he is assigned to protect a whistleblower who wishes to expose a corrupt military defence contractor. However, the military hires a heavily armed team of mercenaries to kill her and it's up to Carter to stop them at any cost. Thriller Action  Mike Mizanin Melissa Roxburgh Josh Blacker Matthew MacCaull Paul McGillion William Kaufman"
291,Riding Giants,Documentary,2004,0.895946,,Riding Giants is story about big wave surfers who have become heroes and legends in their sport. Directed by the skateboard guru Stacy Peralta. Documentary ocean california sea beach surfer hawaii wave sun surfboard lifestyle extremsport Jeff Clark Darrick Doerner Laird Hamilton Dave Kalama David H. Kalama Jr. Stacy Peralta
8698,The League of Extraordinary Gentlemen,Fantasy Action Thriller Science Fiction,2003,47.436675,,"To prevent a world war from breaking out, famous characters from Victorian literature band together to do battle against a cunning villain. Fantasy Action Thriller Science Fiction saving the world vampire bite men invisible man captain nemo allan quatermain venezia immortal Sean Connery Peta Wilson Shane West Stuart Townsend Jason Flemyng Stephen Norrington"
208869,Plastic,Drama Action Comedy Crime,2014,9.70276,,"Sam &amp; Fordy run a credit card fraud scheme, but when they steal from the wrong man, they find themselves threatened by sadistic gangster. They need to raise £5m and pull off a daring diamond heist to clear their debt. Drama Action Comedy Crime  Ed Speleers Will Poulter Alfie Allen Sebastian de Souza Emma Rigby Julian Gilbey"
357837,Dancin' It's On,Drama Romance,2015,0.186234,,"This coming of age Dance Film, in the spirit of Dirty Dancing, Karate Kid, and High School Musical - is about a young girl from Beverly Hills, Jennifer who is visiting her Father's Panama City Beach Hotel during Summer Break, and falls in love with a Young Boy, Ken who works as a Dishwasher. Even though both are from different backgrounds, they share the same passion... DANCE and partner with each other to enter the 2nd Annual Florida State-Wide Dance Contest. While preparing for the contest, Jennifer and Ken must overcome scheming dance partners, a meddling father, and their own doubts for their love to prevail. Drama Romance dancing competition hotel florida dance teacher Witney Carson Chehon Wespi-Tschopp Gary Daniels David Winters Jordan Clark David Winters"
11870,Big Fat Liar,Comedy Family,2002,9.125594,,"Fourteen-year-old Jason Shepherd (Muniz) has a reputation for stretching the truth. So, when big-time Hollywood producer Marty Wolf (Paul Giamatti) steals his class paper and turns it into a smash movie, no one believes Jason's latest tall tale! On a cross-country adventure to set the record straight, Jason and best friend Kaylee (Bynes) devise a high-tech plan to squeeze the truth out of Wolf. Comedy Family screenplay film producer auto right and justice liar essay intellectual property Frankie Muniz Paul Giamatti Amanda Bynes Amanda Detmer Donald Faison Shawn Levy"
